<?xml version="1.0" encoding="UTF-8" standalone="no"?>
<mdc:medicines xmlns:xsi="http://www.w3.org/2001/XMLSchema-instance"
               xmlns:mdc="http://www.example.com/medicines"
               xsi:schemaLocation="http://www.example.com/medicines medicines.xsd">
    <mdc:medicine id="a23e4567-e89b-12d3-a456-426614174000">
        <mdc:name>Upsarin Upsa</mdc:name>
        <mdc:company>UPSA, SAS.</mdc:company>
        <mdc:group>NSAID</mdc:group>
        <mdc:versions>
            <mdc:version>
                <mdc:medicineType>effervescent tablets</mdc:medicineType>
                <mdc:package>
                    <mdc:packageType>pack</mdc:packageType>
                    <mdc:number>16</mdc:number>
                    <mdc:price>19.60</mdc:price>
                </mdc:package>
                <mdc:dosage>500 mg</mdc:dosage>
                <mdc:certificate>
                    <mdc:name>Registration certificate</mdc:name>
                    <mdc:whoIssued>Ministry of Health of the Republic of Belarus</mdc:whoIssued>
                    <mdc:registrationNumber>6664/04/07/09/12/14/17/19</mdc:registrationNumber>
                    <mdc:registrationDateFrom>2019-08-02</mdc:registrationDateFrom>
                    <mdc:registrationDateTo>2024-08-02</mdc:registrationDateTo>
                </mdc:certificate>
            </mdc:version>
            <mdc:version>
                <mdc:medicineType>effervescent tablets</mdc:medicineType>
                <mdc:package isSealed="true">
                    <mdc:packageType>tube</mdc:packageType>
                    <mdc:number>10</mdc:number>
                    <mdc:price>8.02</mdc:price>
                </mdc:package>
                <mdc:dosage>500 mg</mdc:dosage>
                <mdc:certificate>
                    <mdc:name>Registration certificate</mdc:name>
                    <mdc:whoIssued>Ministry of Health of the Republic of Belarus</mdc:whoIssued>
                    <mdc:registrationNumber>1610/96/01/06/10/12/16/19</mdc:registrationNumber>
                    <mdc:registrationDateFrom>2016-06-06</mdc:registrationDateFrom>
                    <mdc:registrationDateTo>2026-06-06</mdc:registrationDateTo>
                </mdc:certificate>
            </mdc:version>
        </mdc:versions>
    </mdc:medicine>
    <mdc:medicine id="s234ds67-e89b-12d3-a456-426614174000">
        <mdc:name>Aspirin-C</mdc:name>
        <mdc:company>BAYER BITTERFELD, GmbH</mdc:company>
        <mdc:group>NSAID</mdc:group>
        <mdc:versions>
            <mdc:version>
                <mdc:medicineType>effervescent tablets</mdc:medicineType>
                <mdc:package>
                    <mdc:packageType>pack</mdc:packageType>
                    <mdc:number>10</mdc:number>
                    <mdc:price>9.00</mdc:price>
                </mdc:package>
                <mdc:dosage>400 mg</mdc:dosage>
                <mdc:certificate>
                    <mdc:name>Registration certificate</mdc:name>
                    <mdc:whoIssued>Ministry of Health of the Republic of Belarus</mdc:whoIssued>
                    <mdc:registrationNumber>2459/96/02/07/12/17</mdc:registrationNumber>
                    <mdc:registrationDateFrom>2017-10-30</mdc:registrationDateFrom>
                    <mdc:registrationDateTo>2022-10-30</mdc:registrationDateTo>
                </mdc:certificate>
            </mdc:version>
        </mdc:versions>
    </mdc:medicine>
    <mdc:medicine id="aq3e4567-e89b-12d3-a456-426614174820">
        <mdc:name>Alka-Seltze</mdc:name>
        <mdc:company>BAYER BITTERFELD, GmbH</mdc:company>
        <mdc:group>NSAID</mdc:group>
        <mdc:versions>
            <mdc:version>
                <mdc:medicineType>effervescent tablets</mdc:medicineType>
                <mdc:package>
                    <mdc:packageType>pack</mdc:packageType>
                    <mdc:number>10</mdc:number>
                    <mdc:price>11.22</mdc:price>
                </mdc:package>
                <mdc:dosage>324 mg</mdc:dosage>
                <mdc:certificate>
                    <mdc:name>Registration certificate</mdc:name>
                    <mdc:whoIssued>Ministry of Health of the Republic of Belarus</mdc:whoIssued>
                    <mdc:registrationNumber>454/94/04/07/09/14/19</mdc:registrationNumber>
                    <mdc:registrationDateFrom>2017-10-31</mdc:registrationDateFrom>
                    <mdc:registrationDateTo>2022-10-31</mdc:registrationDateTo>
                </mdc:certificate>
            </mdc:version>
        </mdc:versions>
    </mdc:medicine>
    <mdc:medicine id="q234ty67-g39s-12d3-a456-426614174111">
        <mdc:name>Cardiomagnyl</mdc:name>
        <mdc:company>TAKEDA, GmbH</mdc:company>
        <mdc:group>NSAID</mdc:group>
        <mdc:versions>
            <mdc:version>
                <mdc:medicineType>tablets</mdc:medicineType>
                <mdc:package>
                    <mdc:packageType>jar</mdc:packageType>
                    <mdc:number>100</mdc:number>
                    <mdc:price>18.03</mdc:price>
                </mdc:package>
                <mdc:dosage>75 mg</mdc:dosage>
                <mdc:certificate>
                    <mdc:name>Registration certificate</mdc:name>
                    <mdc:whoIssued>Ministry of Health of the Republic of Belarus</mdc:whoIssued>
                    <mdc:registrationNumber>452/02/09/01/24/11</mdc:registrationNumber>
                    <mdc:registrationDateFrom>2019-12-21</mdc:registrationDateFrom>
                    <mdc:registrationDateTo>2024-12-21</mdc:registrationDateTo>
                </mdc:certificate>
            </mdc:version>
        </mdc:versions>
    </mdc:medicine>
    <mdc:medicine id="u234ty77-g29q-12w3-a354-4s6f14674222">
        <mdc:name>Omez</mdc:name>
        <mdc:company>Dr. Reddy's Laboratories, LTD</mdc:company>
        <mdc:group>proton pump inhibitor</mdc:group>
        <mdc:versions>
            <mdc:version>
                <mdc:medicineType>capsules</mdc:medicineType>
                <mdc:package>
                    <mdc:packageType>pack</mdc:packageType>
                    <mdc:number>30</mdc:number>
                    <mdc:price>34.06</mdc:price>
                </mdc:package>
                <mdc:dosage>20 mg</mdc:dosage>
                <mdc:certificate>
                    <mdc:name>Registration certificate</mdc:name>
                    <mdc:whoIssued>Ministry of Health of the Republic of Belarus</mdc:whoIssued>
                    <mdc:registrationNumber>1136/95/01/06/11/17</mdc:registrationNumber>
                    <mdc:registrationDateFrom>2017-01-13</mdc:registrationDateFrom>
                    <mdc:registrationDateTo>2023-01-13</mdc:registrationDateTo>
                </mdc:certificate>
            </mdc:version>
            <mdc:version>
                <mdc:medicineType>capsules</mdc:medicineType>
                <mdc:package>
                    <mdc:packageType>pack</mdc:packageType>
                    <mdc:number>30</mdc:number>
                    <mdc:price>23.82</mdc:price>
                </mdc:package>
                <mdc:dosage>10 mg</mdc:dosage>
                <mdc:certificate>
                    <mdc:name>Registration certificate</mdc:name>
                    <mdc:whoIssued>Ministry of Health of the Republic of Belarus</mdc:whoIssued>
                    <mdc:registrationNumber>8956/09/10/10/11/14/17/19/21/21</mdc:registrationNumber>
                    <mdc:registrationDateFrom>2019-08-29</mdc:registrationDateFrom>
                    <mdc:registrationDateTo>2024-08-29</mdc:registrationDateTo>
                </mdc:certificate>
            </mdc:version>
            <mdc:version>
                <mdc:medicineType>capsules</mdc:medicineType>
                <mdc:package>
                    <mdc:packageType>pack</mdc:packageType>
                    <mdc:number>30</mdc:number>
                    <mdc:price>49.50</mdc:price>
                </mdc:package>
                <mdc:dosage>40 mg</mdc:dosage>
                <mdc:certificate>
                    <mdc:name>Registration certificate</mdc:name>
                    <mdc:whoIssued>Ministry of Health of the Republic of Belarus</mdc:whoIssued>
                    <mdc:registrationNumber>9346/02/10/10/11/14/17/20/22/22</mdc:registrationNumber>
                    <mdc:registrationDateFrom>2020-04-12</mdc:registrationDateFrom>
                    <mdc:registrationDateTo>2025-04-12</mdc:registrationDateTo>
                </mdc:certificate>
            </mdc:version>
        </mdc:versions>
    </mdc:medicine>
    <mdc:medicine id="q114ty67-g39s-12de-a456-42as14174111">
        <mdc:name>Omeprez</mdc:name>
        <mdc:company>S.C. Rompharm Company S.R.L.</mdc:company>
        <mdc:group>proton pump inhibitor</mdc:group>
        <mdc:versions>
            <mdc:version>
                <mdc:medicineType>capsules</mdc:medicineType>
                <mdc:package>
                    <mdc:packageType>pack</mdc:packageType>
                    <mdc:number>30</mdc:number>
                    <mdc:price>34.32</mdc:price>
                </mdc:package>
                <mdc:dosage>20 mg</mdc:dosage>
                <mdc:certificate>
                    <mdc:name>Registration certificate</mdc:name>
                    <mdc:whoIssued>Ministry of Health of the Republic of Belarus</mdc:whoIssued>
                    <mdc:registrationNumber>6217/03/07/08/13/18</mdc:registrationNumber>
                    <mdc:registrationDateFrom>2018-12-03</mdc:registrationDateFrom>
                    <mdc:registrationDateTo>2023-12-03</mdc:registrationDateTo>
                </mdc:certificate>
            </mdc:version>
        </mdc:versions>
    </mdc:medicine>
</mdc:medicines>